{
  "schema_version": "2.0",
  "state": "template",
  "experiment_id": "topology-shift",
  "title": "Controlled Topology Shift",
  "purpose": {
    "question": "Does the model detect and report loss of fidelity when one physical endpoint placement changes?",
    "comparison": "Prediction residual and gate state before versus after a preregistered endpoint placement change.",
    "primary_metric": "Time to gate abstention or documented retained fidelity after the shift."
  },
  "setup": {
    "nodes": null,
    "thread_channel": null,
    "placement": null,
    "firmware_reference": null
  },
  "execution": {
    "warmup_s": null,
    "measurement_s": null,
    "cooldown_s": null,
    "repetitions": null,
    "seed": null
  },
  "traffic": { "streams": null },
  "scenario": { "event": null, "at_s": null, "duration_s": null, "target": null },
  "treatment": { "mode": null, "candidate_action": null, "control_profile": null, "host_model": null, "remote_actuation": null },
  "acceptance": { "counter_reconciliation": null, "minimum_critical_on_time_pdr": null, "negative_case": null },
  "evidence": { "required_artifacts": null, "operator_notes_required": null, "topology_photo_required": null },
  "_todo": [
    {
      "path": "/setup",
      "action": "Define two repeatable endpoint locations before collecting a topology-shift trace.",
      "method": "Mark the before and after position of one chosen endpoint with distance, height, orientation, obstacles, cable routing, and photographs. Freeze gateway, RCP, and other endpoint positions; record actual Thread role, parent, partition, and link evidence at both positions.",
      "done_when": "A second operator can recreate both positions and distinguish a planned shift from accidental movement."
    },
    {
      "path": "/scenario",
      "action": "Schedule exactly one physical shift after a stable baseline interval.",
      "method": "Reuse a completed baseline traffic profile, set topology_shift target to the selected endpoint, choose the move time after warm-up, and reserve a post-shift interval long enough to observe reattachment or stable degradation. Do not introduce a load step or restart in the same run.",
      "done_when": "The ready file defines event time, duration, target, and unchanged traffic so placement is the sole intended disturbance."
    },
    {
      "path": "/treatment",
      "action": "Predeclare what counts as a correct fidelity response.",
      "method": "Run as a host-model shadow with remote actuation disabled unless the primary safety chain is already proven. Freeze the calibrated gate limits, service floor, and evidence list containing before/after topology snapshots, residual/gate report, raw events, and operator notes.",
      "done_when": "The report can honestly conclude either that the gate abstained or that fidelity remained within predeclared bounds; neither outcome is chosen after seeing the graph."
    }
  ]
}
