{
  "schema_version": "2.0",
  "state": "template",
  "experiment_id": "power-policy",
  "title": "Energy-Aware Policy Check",
  "purpose": {
    "question": "Can a bounded low-power endpoint profile reduce measured energy without violating critical service?",
    "comparison": "Always-on and low-power endpoint profiles under the same measured traffic block.",
    "primary_metric": "Energy per successfully delivered critical packet, reported with service quality."
  },
  "setup": {
    "nodes": null,
    "thread_channel": null,
    "placement": null,
    "firmware_reference": null
  },
  "execution": {
    "warmup_s": null,
    "measurement_s": null,
    "cooldown_s": null,
    "repetitions": null,
    "seed": null
  },
  "traffic": { "streams": null },
  "scenario": { "event": null, "at_s": null, "duration_s": null, "target": null },
  "treatment": { "mode": null, "candidate_action": null, "control_profile": null, "host_model": null, "remote_actuation": null },
  "acceptance": { "counter_reconciliation": null, "minimum_critical_on_time_pdr": null, "negative_case": null },
  "evidence": { "required_artifacts": null, "operator_notes_required": null, "topology_photo_required": null },
  "_todo": [
    {
      "path": "/setup",
      "action": "Define a calibrated endpoint power path before comparing profiles.",
      "method": "Choose the measured C6 rail, INA219 module, I2C configuration, shunt value, sample interval, and inclusion boundary for board regulator, USB serial, LEDs, and sensor. Compare the module with a trusted meter or controlled load where possible, and record limitations if only relative readings are defensible.",
      "done_when": "versions.json contains a calibration identifier and the operator note states exactly what energy boundary is being measured."
    },
    {
      "path": "/treatment",
      "action": "Specify a bounded low-power profile that remains observable and recoverable.",
      "method": "Define the always-on and low-power endpoint configurations, wake/attachment behavior, policy acknowledgement behavior, and local fallback. Run a sampler-enabled versus sampler-disabled overhead control before comparing energy profiles.",
      "done_when": "The low-power profile has a versioned identity, its measurement overhead is documented, and it has not been confused with a disconnected device."
    },
    {
      "path": "/execution",
      "action": "Freeze matched traffic and service acceptance before taking energy data.",
      "method": "Copy the completed stable workload, physical placement, and channel. Set duration and repetitions from steady-state pilot traces, require counter reconciliation and the same critical service floor for both profiles, and list energy.csv plus raw counter evidence as required artifacts.",
      "done_when": "A lower energy figure cannot be reported unless the corresponding run meets the same critical service condition as its matched comparison."
    }
  ]
}
